{
  "feature_id": "ORD-CANCEL-01",
  "build_id": "web-1.42.0+1289",
  "coverage_scope": "changed_code",
  "coverage_percent": 82,
  "hotspot_review_percent": 100,
  "new_issues": {
    "blocker": 0,
    "critical": 0
  },
  "source_refs": [
    {
      "id": "CI-2026-05-04-1289",
      "kind": "auto_test",
      "excerpt": "changed-code coverage 82%"
    }
  ],
  "test_suites": [
    {
      "suite_id": "example-regression",
      "status": "passed",
      "total": 2,
      "passed": 2,
      "failed": 0,
      "errors": 0,
      "skipped": 0,
      "source_refs": [
        {
          "id": "EXAMPLE-REQUIRED-SUITE",
          "kind": "auto_test",
          "excerpt": "説明用の架空suite実績。実行証跡ではない。"
        }
      ]
    }
  ]
}
